threadKind,canReply,isPublic,topLevelCommentKind,commentAuthorChannelId,commentAuthorChannelUrl,commentAuthorDisplayName,commentAuthorProfileImageUrl,commentCanRate,commentLikeCount,commentPublishedAt,commentTextOriginal,commentUpdatedAt,commentViewerRating,commentTotalReplyCount,userId,videoId,commentTextDisplay,Standing
youtube#commentThread,TRUE,TRUE,youtube#comment,UCLSANUYHVbeq9XMBFxy_jMQ,http://www.youtube.com/channel/UCLSANUYHVbeq9XMBFxy_jMQ,piper.spirit,https://yt3.ggpht.com/ytc/AKedOLT-0Rj9e_CjebvXfuwEXBsLctNbWzMe8ktzzuwQrA=s48-c-k-c0x00ffffff-no-rj,TRUE,0,2021-12-13T00:44:02Z,"No sympathy for any of these people. They risk their own health by this behaviour, but more importantly, they put in danger the health and lives of others they come in contact with. Families in India suffered greatly from Delta, and thousands were lost because there was no vaccine or effective medication. Yet these people in this video can get the vaccine, but choose not to...",2021-12-13T00:44:02Z,none,0,UgwWY-yErq1po_smRYV4AaABAg,pd8P12BXebo,"No sympathy for any of these people. They risk their own health by this behaviour, but more importantly, they put in danger the health and lives of others they come in contact with. Families in India suffered greatly from Delta, and thousands were lost because there was no vaccine or effective medication. Yet these people in this video can get the vaccine, but choose not to...",1
youtube#commentThread,TRUE,TRUE,youtube#comment,UC9UD4If6j7g1aQuA0XruSgQ,http://www.youtube.com/channel/UC9UD4If6j7g1aQuA0XruSgQ,J Eilers,https://yt3.ggpht.com/ytc/AKedOLTtv8UbvKYMa1e6LetcXMqUP90CeOQ0Daa_PQ=s48-c-k-c0x00ffffff-no-rj,TRUE,0,2021-12-12T23:50:51Z,"My family is going through this now!   Some of us are vaccinated and some are not.  We have had 13 members who have/had Covid.   I have a family member that was put on a ventilator this morning and he was not vaccinated!!  Unfortunately, we know he is not going to make it.  Please get vaccinated 😡",2021-12-12T23:50:51Z,none,0,Ugw4Hp_6G9jNasvBn5N4AaABAg,pd8P12BXebo,"My family is going through this now!   Some of us are vaccinated and some are not.  We have had 13 members who have/had Covid.   I have a family member that was put on a ventilator this morning and he was not vaccinated!!  Unfortunately, we know he is not going to make it.  Please get vaccinated 😡",1
youtube#commentThread,TRUE,TRUE,youtube#comment,UCA-DdHz1dm9E4DbTWPj60Pg,http://www.youtube.com/channel/UCA-DdHz1dm9E4DbTWPj60Pg,Inés Galan,https://yt3.ggpht.com/ytc/AKedOLQ-CA_lAzRIqu4wKzy176izHYd5KKYpBgGDLX7xzQ=s48-c-k-c0x00ffffff-no-rj,TRUE,2,2021-12-12T19:10:38Z,People not understanding how vaccines work tells a lot about the level of intelligence of this individuals. Very very stupid.,2021-12-12T19:10:38Z,none,0,UgyXnncOOtuyrAAY7-p4AaABAg,pd8P12BXebo,People not understanding how vaccines work tells a lot about the level of intelligence of this individuals. Very very stupid.,1
youtube#commentThread,TRUE,TRUE,youtube#comment,UCmkzaWXX4IZQFNGEg2hhCNQ,http://www.youtube.com/channel/UCmkzaWXX4IZQFNGEg2hhCNQ,urmila16,https://yt3.ggpht.com/ytc/AKedOLQ2Ma-B8IJ78CeKlz4kIiC8A4n_EVvZRu4udw=s48-c-k-c0x00ffffff-no-rj,TRUE,0,2021-12-12T18:36:22Z,They're dying but taking others along with them and allowing the virus to spread and therefore mutate. V selfish.,2021-12-12T18:36:22Z,none,0,UgyPduBYP9-k_mSv1MJ4AaABAg,pd8P12BXebo,They&#39;re dying but taking others along with them and allowing the virus to spread and therefore mutate. V selfish.,1
youtube#commentThread,TRUE,TRUE,youtube#comment,UCniERO9VnYR1fH_a1buI4aw,http://www.youtube.com/channel/UCniERO9VnYR1fH_a1buI4aw,Marjorie Pope,https://yt3.ggpht.com/ytc/AKedOLTAvR_apeNQmkBVgnXGLIkpUS5uGyqwAgmsRA=s48-c-k-c0x00ffffff-no-rj,TRUE,0,2021-12-12T15:11:06Z,I’m not sorry for them. Get vaxed and stop listening to any gov or media or social media,2021-12-12T15:11:06Z,none,0,Ugz4QJwaxEe-0uk9jc14AaABAg,pd8P12BXebo,I’m not sorry for them. Get vaxed and stop listening to any gov or media or social media,1
youtube#commentThread,TRUE,TRUE,youtube#comment,UC7BcPuOhTIfVSesKXOlXQ6Q,http://www.youtube.com/channel/UC7BcPuOhTIfVSesKXOlXQ6Q,Paul Fischer,https://yt3.ggpht.com/ytc/AKedOLTu7Mg2fGE2_3dQm96W9S3TIaFrAmb8Qt-0SkAVHw=s48-c-k-c0x00ffffff-no-rj,TRUE,0,2021-12-12T13:18:31Z,"why are people so selfish? they only care about themselves. i just want my family and community to be safe, and help all the nurses and doctors that help us, simple",2021-12-12T13:18:31Z,none,1,Ugx3-s1275au1cWHJQR4AaABAg,pd8P12BXebo,"why are people so selfish? they only care about themselves. i just want my family and community to be safe, and help all the nurses and doctors that help us, simple",1
youtube#commentThread,TRUE,TRUE,youtube#comment,UCLW1Smf-kGLAqQDFdnwhWcg,http://www.youtube.com/channel/UCLW1Smf-kGLAqQDFdnwhWcg,calvinK GermanViet,https://yt3.ggpht.com/ytc/AKedOLTZA9xJwB6uada3ich7kgSEi0m4ZpFMvzyMTQ=s48-c-k-c0x00ffffff-no-rj,TRUE,1,2021-12-12T11:28:06Z,Personal freedom stops when it endangers other person's life or freedom. Some civic education is missing here,2021-12-12T11:28:06Z,none,0,UgwloMQeCwvMXJkMGMx4AaABAg,pd8P12BXebo,Personal freedom stops when it endangers other person&#39;s life or freedom. Some civic education is missing here,1
youtube#commentThread,TRUE,TRUE,youtube#comment,UCLAhA1wCPOOByG11RFbL_-g,http://www.youtube.com/channel/UCLAhA1wCPOOByG11RFbL_-g,Pengui,https://yt3.ggpht.com/ytc/AKedOLQMTz2XbF1sBz7op4BBL37821jeRnmu29GtyA=s48-c-k-c0x00ffffff-no-rj,TRUE,1,2021-12-12T07:37:44Z,"Interesting how no one (besides anti-vaxxers) bats an eye at normal vaccinations needed for school enrollment, but are so against this one. And no, the research didn't come out of thin air. We had an outbreak of a more fatal version of coronavirus before, and research on it has been going on for a long time. Genuinely don't know where all of these conspiracy theorists are coming from.",2021-12-12T07:37:44Z,none,0,UgzgE9DaAQ6lvrF2txR4AaABAg,pd8P12BXebo,"Interesting how no one (besides anti-vaxxers) bats an eye at normal vaccinations needed for school enrollment, but are so against this one. And no, the research didn&#39;t come out of thin air. We had an outbreak of a more fatal version of coronavirus before, and research on it has been going on for a long time. Genuinely don&#39;t know where all of these conspiracy theorists are coming from.",1
youtube#commentThread,TRUE,TRUE,youtube#comment,UC0KEFooL2r_-Fw0n-drBlvA,http://www.youtube.com/channel/UC0KEFooL2r_-Fw0n-drBlvA,gene ng,https://yt3.ggpht.com/ytc/AKedOLQjaUlmzfIlUwdeLMTVecv-y_3jHHOKSu5XNQ=s48-c-k-c0x00ffffff-no-rj,TRUE,0,2021-12-12T06:18:50Z,"These anti vaxers are animals.  If they die, they die.",2021-12-12T06:18:50Z,none,1,UgzR5MSwGEX-NjWfRCB4AaABAg,pd8P12BXebo,"These anti vaxers are animals.  If they die, they die.",1
youtube#commentThread,TRUE,TRUE,youtube#comment,UC_UEzWUNQHyEG_GDygTAUGg,http://www.youtube.com/channel/UC_UEzWUNQHyEG_GDygTAUGg,spencer8501,https://yt3.ggpht.com/ytc/AKedOLT1qE4hko3VmEBkyRe8b-eIvjOypgnbMt96_A=s48-c-k-c0x00ffffff-no-rj,TRUE,0,2021-12-12T02:05:24Z,Anything is better than nothing. We should not allow this virus to defeat us . Take the vaccine for your love ones,2021-12-12T02:05:24Z,none,0,UgyFLs646JpJEdBG5Oh4AaABAg,pd8P12BXebo,Anything is better than nothing. We should not allow this virus to defeat us . Take the vaccine for your love ones,1
youtube#commentThread,TRUE,TRUE,youtube#comment,UC39--_dD1iUNn00YkBKdU6g,http://www.youtube.com/channel/UC39--_dD1iUNn00YkBKdU6g,Unkle Vinh's Journal,https://yt3.ggpht.com/ytc/AKedOLTa1sWwAQNG-wU_i7zU7nILQ23rKIVPh397Jgss=s48-c-k-c0x00ffffff-no-rj,TRUE,0,2021-12-11T23:01:02Z,"I have a friend he was against the Vaccine for the reason being unsure about the safety of it, mean while he did almost every illegal drugs that floating around the country. Ironic isn't it? He has Covid,  suffer almost a month in the ICU, he took to shot right away after and swear to take every shot that is available to him by the government.... :-)",2021-12-11T23:01:02Z,none,0,UgxblebZvblMKlu7JON4AaABAg,pd8P12BXebo,"I have a friend he was against the Vaccine for the reason being unsure about the safety of it, mean while he did almost every illegal drugs that floating around the country. Ironic isn&#39;t it? He has Covid,  suffer almost a month in the ICU, he took to shot right away after and swear to take every shot that is available to him by the government.... :-)",1
youtube#commentThread,TRUE,TRUE,youtube#comment,UCYbOPzRZMPSQ_l3JDMULO-w,http://www.youtube.com/channel/UCYbOPzRZMPSQ_l3JDMULO-w,Aloy,https://yt3.ggpht.com/IsHEzPGleix1q1J9I6i4B8vYawYesAxtRi5zvIm24vzhJApYTZVywrSi-Jhp8-m-Tt7YMyETKA=s48-c-k-c0x00ffffff-no-rj,TRUE,0,2021-12-11T08:47:05Z,"We shouldn't treat unvaxed covid patients anymore. It's insane that we use all that effort time and money while people with cancer need to wait for their surgeries. Stop taking the unvaxed in, they have the freedom to die in their homes.",2021-12-11T08:47:05Z,none,1,UgyB0alpwrdTsQJEiBt4AaABAg,pd8P12BXebo,"We shouldn&#39;t treat unvaxed covid patients anymore. It&#39;s insane that we use all that effort time and money while people with cancer need to wait for their surgeries. Stop taking the unvaxed in, they have the freedom to die in their homes.",1
youtube#commentThread,TRUE,TRUE,youtube#comment,UClKjbJJX08UuM0qsxkI7RJQ,http://www.youtube.com/channel/UClKjbJJX08UuM0qsxkI7RJQ,Gettin Radd & Fuggin Bustn,https://yt3.ggpht.com/ytc/AKedOLRMX0CBo30PTf9FHsyFedfssrbhgeoJVq6ofW11Jw=s48-c-k-c0x00ffffff-no-rj,TRUE,0,2021-12-11T06:48:43Z,If you choose to not get vaccinate your insurance should choose to not pay your hospital bill when you do.,2021-12-11T06:48:43Z,none,0,UgznoYcqeGm1wwTDLW94AaABAg,pd8P12BXebo,If you choose to not get vaccinate your insurance should choose to not pay your hospital bill when you do.,1
youtube#commentThread,TRUE,TRUE,youtube#comment,UCO6nD0b4jjoVrZqPMkY-wLg,http://www.youtube.com/channel/UCO6nD0b4jjoVrZqPMkY-wLg,sawa139,https://yt3.ggpht.com/ytc/AKedOLSrbe93rSk48_z8ltbQXRMTM6tILuBpS1ftZg=s48-c-k-c0x00ffffff-no-rj,TRUE,0,2021-12-11T03:04:03Z,Take him off those machines then. Don't want to get vaccinated don't come in for treatment. Those healthcare workers are burnt out and making them care for people who refuse to do everything they can to prevent this sickness is terrible,2021-12-11T03:04:03Z,none,0,UgwnbXFygqSOebhvLop4AaABAg,pd8P12BXebo,Take him off those machines then. Don&#39;t want to get vaccinated don&#39;t come in for treatment. Those healthcare workers are burnt out and making them care for people who refuse to do everything they can to prevent this sickness is terrible,1
youtube#commentThread,TRUE,TRUE,youtube#comment,UC-LFv43_FTHYFflP6zqK_lw,http://www.youtube.com/channel/UC-LFv43_FTHYFflP6zqK_lw,Mike Sharcott,https://yt3.ggpht.com/ytc/AKedOLRKsPOK2Pc21CcGj8K8dzPWZOQ9WF2PHEJJWw=s48-c-k-c0x00ffffff-no-rj,TRUE,0,2021-12-10T23:12:49Z,"Low Education Levels + Religious Beliefs= antivax idiots.  Amazing to see how them touting Political and Religious opinions that nobody can tell them what to do, but I bet they are listening very well about keeping those O2 masks on and taking any medication given to them vs dying once they hit the ICU",2021-12-10T23:12:49Z,none,0,UgyX4iH8wf20JQxFVZ54AaABAg,pd8P12BXebo,"Low Education Levels + Religious Beliefs= antivax idiots.  Amazing to see how them touting Political and Religious opinions that nobody can tell them what to do, but I bet they are listening very well about keeping those O2 masks on and taking any medication given to them vs dying once they hit the ICU",1
youtube#commentThread,TRUE,TRUE,youtube#comment,UCP9KUM9q-F-xR0VyN2XahpQ,http://www.youtube.com/channel/UCP9KUM9q-F-xR0VyN2XahpQ,Mike O,https://yt3.ggpht.com/ytc/AKedOLQmGpyYCsSUvIdwYqaTg2F9FYkFN0XyuPG5Zw=s48-c-k-c0x00ffffff-no-rj,TRUE,0,2021-12-10T22:24:01Z,U need to worry about others and get it even though it only lessens the symptoms,2021-12-10T22:24:01Z,none,0,UgzR-sCGCybCO84qUHV4AaABAg,pd8P12BXebo,U need to worry about others and get it even though it only lessens the symptoms,1
youtube#commentThread,TRUE,TRUE,youtube#comment,UCnH6v1la_17OB0tftd52Ihw,http://www.youtube.com/channel/UCnH6v1la_17OB0tftd52Ihw,Lada minuetkittens,https://yt3.ggpht.com/ytc/AKedOLSU0HhOQALlTCNeTkm_ZqWcTY2FDuSW_9WX8ec=s48-c-k-c0x00ffffff-no-rj,TRUE,0,2021-12-10T21:51:28Z,"No, not freedom. Dying in the name of their own stupidity.
If unvaccinated people do not do anything for their health, how  can they ask doctors and nurses in ICU TO DO IT FOR THEM?
You are not vaccinated - you do not deserve the HOSPITAL TREATMENT!!!",2021-12-10T21:51:28Z,none,0,UgwHUoFYokYDDRXVLOF4AaABAg,pd8P12BXebo,"No, not freedom. Dying in the name of their own stupidity.<br>If unvaccinated people do not do anything for their health, how  can they ask doctors and nurses in ICU TO DO IT FOR THEM?<br>You are not vaccinated - you do not deserve the HOSPITAL TREATMENT!!!",1
youtube#commentThread,TRUE,TRUE,youtube#comment,UCZwGFngtRhQl0k1oJVI5ZgQ,http://www.youtube.com/channel/UCZwGFngtRhQl0k1oJVI5ZgQ,Fessi fessiibieneisokariari,https://yt3.ggpht.com/ytc/AKedOLQZwz2MNeMGUORyEm3Aw7JA1-EoOp3S5mGQMLdplA=s48-c-k-c0x00ffffff-no-rj,TRUE,0,2021-12-10T20:20:45Z,As someone who constantly sees the rise in cases and the death rate each day I will say this no paper or scientific findings has ever said that taking the vaccine will stop you from contacting covid. What is even sadder and frustrating to watch is that the people who have gotten covid though a mild case still remain unvaccinated. I wanna truly ask how serious do you want it to be before you decide you need to protect not only yourself but the people around you who you love darely,2021-12-10T20:20:45Z,none,0,Ugx-aKdb5Uue6cVQCRp4AaABAg,pd8P12BXebo,As someone who constantly sees the rise in cases and the death rate each day I will say this no paper or scientific findings has ever said that taking the vaccine will stop you from contacting covid. What is even sadder and frustrating to watch is that the people who have gotten covid though a mild case still remain unvaccinated. I wanna truly ask how serious do you want it to be before you decide you need to protect not only yourself but the people around you who you love darely,1
youtube#commentThread,TRUE,TRUE,youtube#comment,UCOhvEbJin-3nwQzti3Ydt4w,http://www.youtube.com/channel/UCOhvEbJin-3nwQzti3Ydt4w,Nosmo King,https://yt3.ggpht.com/ytc/AKedOLQeBCLxv4MY7U5R7NYcuKr-5SGDE4FacD_hrbkaSyDsQpcwfpbtgvwZAvHCDBm6=s48-c-k-c0x00ffffff-no-rj,TRUE,0,2021-12-10T19:57:42Z,The unvaccinated deserve it.,2021-12-10T19:57:42Z,none,0,UgzlfNQoHjDWt1rWa3h4AaABAg,pd8P12BXebo,The unvaccinated deserve it.,1
youtube#commentThread,TRUE,TRUE,youtube#comment,UChaecHQJBsawDfYgjoQlAkQ,http://www.youtube.com/channel/UChaecHQJBsawDfYgjoQlAkQ,Mamajugs13,https://yt3.ggpht.com/ytc/AKedOLSxGUWirRI0AF7OLkRz6pMtcS3iTRArvFhxxw=s48-c-k-c0x00ffffff-no-rj,TRUE,0,2021-12-10T17:04:20Z,Watching these people struggling to survive COVID and still believing in their choice not to vaccinate... wondering where they went wrong in their lives to become so dellusional and paranoid... 😓,2021-12-10T17:04:20Z,none,0,UgzAEayUvtocfghsVg14AaABAg,pd8P12BXebo,Watching these people struggling to survive COVID and still believing in their choice not to vaccinate... wondering where they went wrong in their lives to become so dellusional and paranoid... 😓,1
youtube#commentThread,TRUE,TRUE,youtube#comment,UC8WFcLBbwJuU_HgfMKhiY3g,http://www.youtube.com/channel/UC8WFcLBbwJuU_HgfMKhiY3g,Ai-chan 愛してる,https://yt3.ggpht.com/ht7BjsrBnYYzOXFNUqloIoyeejPOHM50eao2Yifhj355P77ILVnLW7QGeq2tqOhMOZBLC3eUZr0=s48-c-k-c0x00ffffff-no-rj,TRUE,5,2021-12-10T16:42:21Z,"They love freedom so much that they're willing to be free from all the suffering they had been to. 

Trully a natural selection. Less idiots less burden for earth.",2021-12-10T16:42:21Z,none,0,UgxiSEPUaitOKDMYPQ14AaABAg,pd8P12BXebo,They love freedom so much that they&#39;re willing to be free from all the suffering they had been to. <br><br>Trully a natural selection. Less idiots less burden for earth.,1
youtube#commentThread,TRUE,TRUE,youtube#comment,UCIhnT-3AkCQkxYjxkOs5l_Q,http://www.youtube.com/channel/UCIhnT-3AkCQkxYjxkOs5l_Q,Maria Elena Vazquez,https://yt3.ggpht.com/z83ZDmvPchl1dQrIe_XVTxF-sOlCnZ-BKph6sj6ceDCN8M8NvVp_cAsq8Y6C-_QNlwOcrwkU7g=s48-c-k-c0x00ffffff-no-rj,TRUE,1,2021-12-10T13:30:33Z,Thanks to the vaccine I still have my father with me. He’s 74 and he didn’t want to get vaccinated until he saw how many people were being saved because of it. He got it and didn’t feel the symptoms. The problem today is that the truth doesn’t matter. They decide what they think is convenient for them without acknowledging facts and that is scary.,2021-12-10T13:43:04Z,none,0,UgwAKBZl2SfWZ8It1Hp4AaABAg,pd8P12BXebo,Thanks to the vaccine I still have my father with me. He’s 74 and he didn’t want to get vaccinated until he saw how many people were being saved because of it. He got it and didn’t feel the symptoms. The problem today is that the truth doesn’t matter. They decide what they think is convenient for them without acknowledging facts and that is scary.,1
youtube#commentThread,TRUE,TRUE,youtube#comment,UCqI0n5HcD5m5ybl0PRVMyfw,http://www.youtube.com/channel/UCqI0n5HcD5m5ybl0PRVMyfw,SuperSoldier26,https://yt3.ggpht.com/ytc/AKedOLR7S9bz-s49XaHt4RnfCij-zwzqIWQcEKmhTdN0kw=s48-c-k-c0x00ffffff-no-rj,TRUE,0,2021-12-10T12:34:22Z,How many more people have to die for the rest of these other people to get the vaccine and to understand that COVID is serious and is no joke?,2022-01-11T13:06:26Z,none,0,UgwYS9fSepehge0vrLp4AaABAg,pd8P12BXebo,How many more people have to die for the rest of these other people to get the vaccine and to understand that COVID is serious and is no joke?,1
youtube#commentThread,TRUE,TRUE,youtube#comment,UCqI0n5HcD5m5ybl0PRVMyfw,http://www.youtube.com/channel/UCqI0n5HcD5m5ybl0PRVMyfw,SuperSoldier26,https://yt3.ggpht.com/ytc/AKedOLR7S9bz-s49XaHt4RnfCij-zwzqIWQcEKmhTdN0kw=s48-c-k-c0x00ffffff-no-rj,TRUE,0,2021-12-10T12:16:45Z,This is just some people being foolish and stupid to not take the vaccine nor protect themselves,2021-12-10T12:27:59Z,none,0,UgxXcX-P3OGXdvImLLh4AaABAg,pd8P12BXebo,This is just some people being foolish and stupid to not take the vaccine nor protect themselves,1
youtube#commentThread,TRUE,TRUE,youtube#comment,UCqI0n5HcD5m5ybl0PRVMyfw,http://www.youtube.com/channel/UCqI0n5HcD5m5ybl0PRVMyfw,SuperSoldier26,https://yt3.ggpht.com/ytc/AKedOLR7S9bz-s49XaHt4RnfCij-zwzqIWQcEKmhTdN0kw=s48-c-k-c0x00ffffff-no-rj,TRUE,0,2021-12-10T12:15:17Z,These people don’t understand how vicious this stuff is until they’re inflicted with this virus themselves,2021-12-10T12:15:17Z,none,0,UgzXOvFEKw9ikhZSKOF4AaABAg,pd8P12BXebo,These people don’t understand how vicious this stuff is until they’re inflicted with this virus themselves,1
youtube#commentThread,TRUE,TRUE,youtube#comment,UCC1eU4hTbxy3gR3S7ot2juA,http://www.youtube.com/channel/UCC1eU4hTbxy3gR3S7ot2juA,d-cryptoe,https://yt3.ggpht.com/ytc/AKedOLTvsqVT0r4Sk1Ch63q6M30ngNyS_cAh4reYUG8zxI-HXNsWgeLN0w4Is-u5VF7s=s48-c-k-c0x00ffffff-no-rj,TRUE,0,2021-12-10T04:58:09Z,At this point I don't waste a second of my life worrying about the anti vaccinated ppl. They are just being ignorant to science. The shot is about surviving not being immune.. The pack is thinning though....,2021-12-10T04:59:49Z,none,0,UgyXdLqOM8eq-OjqYQl4AaABAg,pd8P12BXebo,At this point I don&#39;t waste a second of my life worrying about the anti vaccinated ppl. They are just being ignorant to science. The shot is about surviving not being immune.. The pack is thinning though....,1
youtube#commentThread,TRUE,TRUE,youtube#comment,UCjMdYW4V2QGOPdVw1OwEl7w,http://www.youtube.com/channel/UCjMdYW4V2QGOPdVw1OwEl7w,Thrust Issue,https://yt3.ggpht.com/x1Q8nq1Gwk8QJB5gzNEEvGmgPAGoUrFJSoCv7RM1AFed3jQvTXkE8gjvoJYHbSd7cGgpHte8vA=s48-c-k-c0x00ffffff-no-rj,TRUE,1,2021-12-10T04:39:50Z,"I don't get the anti-vax idea, You don't believe science or gov't so You didn't get vaccinated so WHY do you go to hospital when you got covid ? 
Stay home, don't get out and try to live with your choice. Don't  forget Doctors and Health Workers are neither god nor slave.",2021-12-10T04:39:50Z,none,0,UgxYf60Bua2NXVobkgt4AaABAg,pd8P12BXebo,"I don&#39;t get the anti-vax idea, You don&#39;t believe science or gov&#39;t so You didn&#39;t get vaccinated so WHY do you go to hospital when you got covid ? <br>Stay home, don&#39;t get out and try to live with your choice. Don&#39;t  forget Doctors and Health Workers are neither god nor slave.",1
youtube#commentThread,TRUE,TRUE,youtube#comment,UC4OooKFvztQg7CYGpyfilmg,http://www.youtube.com/channel/UC4OooKFvztQg7CYGpyfilmg,Judy Coppa,https://yt3.ggpht.com/ytc/AKedOLRf4klKSAQLF8B_hEb8Ztzf43uzYY9PADNUkxqHZZI=s48-c-k-c0x00ffffff-no-rj,TRUE,0,2021-12-10T01:27:02Z,"THIS VIDEO SHOLD BE AIRED ON TV EVERYDAY, EVERY HOUR,. THE ANTI VACCINE PEOPLE SHOULD GET AN EAR FULL, THE ANTI VAXINE GUY DIED FOR HIS FREEDOM TO DECLINE THE VACCINE THAT WOULD  HAVE SAVED HIS LIFE, 53 TOO YOUNG TO DIE. AND IN OTHER COUNTRIES THEY WOULD READILY GET THE VACCINE. I DON'T WANT TO SUFFER SO I AM VACCINATED AND GOING FOR MY BOOSTER ON SUNDAY. I DON'T GET THEIR THINKING, THEIR LOGIC THEIR MISFONDED PRIDE. IT SAVES LIVES YOURS AND THE LIVES OF THE REST OF THE COUNTRY. GROW A BRAIN PEOPLE, GET THE VACCINE!!!!!",2021-12-10T01:27:45Z,none,0,Ugw6UzHOkDEjvLVaAtJ4AaABAg,pd8P12BXebo,"THIS VIDEO SHOLD BE AIRED ON TV EVERYDAY, EVERY HOUR,. THE ANTI VACCINE PEOPLE SHOULD GET AN EAR FULL, THE ANTI VAXINE GUY DIED FOR HIS FREEDOM TO DECLINE THE VACCINE THAT WOULD  HAVE SAVED HIS LIFE, 53 TOO YOUNG TO DIE. AND IN OTHER COUNTRIES THEY WOULD READILY GET THE VACCINE. I DON&#39;T WANT TO SUFFER SO I AM VACCINATED AND GOING FOR MY BOOSTER ON SUNDAY. I DON&#39;T GET THEIR THINKING, THEIR LOGIC THEIR MISFONDED PRIDE. IT SAVES LIVES YOURS AND THE LIVES OF THE REST OF THE COUNTRY. GROW A BRAIN PEOPLE, GET THE VACCINE!!!!!",1
youtube#commentThread,TRUE,TRUE,youtube#comment,UCkDUVaUgb5zfPH_0E9Vimvw,http://www.youtube.com/channel/UCkDUVaUgb5zfPH_0E9Vimvw,sydmic8,https://yt3.ggpht.com/ytc/AKedOLTBQ_AClQvlrZzHz0p1iE_nGW8zYIoLIbIAG1kD=s48-c-k-c0x00ffffff-no-rj,TRUE,0,2021-12-09T19:40:31Z,Some legitimately cannot receive vaccinations. Those who are able and refuse to do so put not only themselves at risk but also selfishly put children or those with severe immune disorders at risk.,2021-12-09T19:40:31Z,none,0,Ugzr-GXSmiLMLEqlhzl4AaABAg,pd8P12BXebo,Some legitimately cannot receive vaccinations. Those who are able and refuse to do so put not only themselves at risk but also selfishly put children or those with severe immune disorders at risk.,1
youtube#commentThread,TRUE,TRUE,youtube#comment,UC3V2j7Nh8CTbZM3W8nJcoig,http://www.youtube.com/channel/UC3V2j7Nh8CTbZM3W8nJcoig,TheDanceact,https://yt3.ggpht.com/ytc/AKedOLRRA6JNjBQVct9VrApOAm_JJCeiFCvd1EnU8AQd3Q=s48-c-k-c0x00ffffff-no-rj,TRUE,0,2021-12-09T18:52:23Z,"I think that the WORLD must understand that EVERYONE must be vaccinated , we have to share more , like Other vírus only comunity imunity can control it! Vaccines save lifes, Penicilin save lifes, opiodes save lifes and they all are dangerous drugs! Deal  with it! Live with it , but dont play with other peoples life!",2021-12-09T18:52:23Z,none,0,UgyIfL9KMPKmq9TdhDd4AaABAg,pd8P12BXebo,"I think that the WORLD must understand that EVERYONE must be vaccinated , we have to share more , like Other vírus only comunity imunity can control it! Vaccines save lifes, Penicilin save lifes, opiodes save lifes and they all are dangerous drugs! Deal  with it! Live with it , but dont play with other peoples life!",1
youtube#commentThread,TRUE,TRUE,youtube#comment,UCc_rxGzxwlhWaKBQcfh2VgA,http://www.youtube.com/channel/UCc_rxGzxwlhWaKBQcfh2VgA,Thomas_Mathysen,https://yt3.ggpht.com/ytc/AKedOLQ4fAgoBKMge2BE3qJ9KhhZCnmjlYLlCquBT5Yg4A=s48-c-k-c0x00ffffff-no-rj,TRUE,0,2021-12-09T17:40:36Z,"I hope this inspired antivaxxers because  this isn't healthy for any of us.  I hope they realize what it's doing to the world, to people, and families.",2021-12-09T17:40:36Z,none,1,UgwYwiKqpjHrqP5Z-QR4AaABAg,pd8P12BXebo,"I hope this inspired antivaxxers because  this isn&#39;t healthy for any of us.  I hope they realize what it&#39;s doing to the world, to people, and families.",1
youtube#commentThread,TRUE,TRUE,youtube#comment,UCSNwGA1Mv6uYDU-EHY8_hJg,http://www.youtube.com/channel/UCSNwGA1Mv6uYDU-EHY8_hJg,asfiya rahman,https://yt3.ggpht.com/ytc/AKedOLTBbEAjlTssCkZRNYNJMhDIaQe-ewIZIzChCcsb=s48-c-k-c0x00ffffff-no-rj,TRUE,0,2021-12-09T17:01:42Z,"The death if Christopher Green hit me really hard because he seemed like a regular person with a ventilator. It’s hard to imagine him dead just after 9 days. It shoes the power of the vaccine. Although there’s a possibility of getting COVID, the chances of hospital is extremely low. I feel extremely horrible and sad for the anti-vaxxers.",2021-12-09T17:01:42Z,none,0,UgwJ-A1tutcs5l7buMd4AaABAg,pd8P12BXebo,"The death if Christopher Green hit me really hard because he seemed like a regular person with a ventilator. It’s hard to imagine him dead just after 9 days. It shoes the power of the vaccine. Although there’s a possibility of getting COVID, the chances of hospital is extremely low. I feel extremely horrible and sad for the anti-vaxxers.",1
