threadKind,canReply,isPublic,topLevelCommentKind,commentAuthorChannelId,commentAuthorChannelUrl,commentAuthorDisplayName,commentAuthorProfileImageUrl,commentCanRate,commentLikeCount,commentPublishedAt,commentTextOriginal,commentUpdatedAt,commentViewerRating,commentTotalReplyCount,userId,videoId,commentTextDisplay,Standing
youtube#commentThread,TRUE,TRUE,youtube#comment,UCIQTygh2bFeqURmmLIvU3cw,http://www.youtube.com/channel/UCIQTygh2bFeqURmmLIvU3cw,Bright Change,https://yt3.ggpht.com/ytc/AKedOLR3skCs0CdRuid5D6mroISIHe1tR5HMFrQ8l1qGjg=s48-c-k-c0x00ffffff-no-rj,TRUE,2,2021-12-21T03:12:06Z,"This technology has NEVER bene used before, this vaccine has NOT been adequately tested for safety or efficacy, there is NO data collection for adverse reactions and the vaccine-injured are being thrown under the bus!  MAYBE THAT'S WHY!!!",2021-12-21T03:12:21Z,none,0,UgyO7eVOJ4hWoKPEgs94AaABAg,Kub1jzGrM8s,"This technology has NEVER bene used before, this vaccine has NOT been adequately tested for safety or efficacy, there is NO data collection for adverse reactions and the vaccine-injured are being thrown under the bus!  MAYBE THAT&#39;S WHY!!!",2
youtube#commentThread,TRUE,TRUE,youtube#comment,UCYZSLbYUOq2EeaYj7AeHJAg,http://www.youtube.com/channel/UCYZSLbYUOq2EeaYj7AeHJAg,richard klegin,https://yt3.ggpht.com/ytc/AKedOLSBvvKnXhBYZ0s_j9LI3it4ZPOR1a64RvbYFkf8=s48-c-k-c0x00ffffff-no-rj,TRUE,1,2021-12-20T02:49:57Z,they dont keep you from getting the virus . people dont understand that it is a sugar pill .  oh well when they all die off because they are dumb sheep only the wolves will be left,2021-12-20T02:49:57Z,none,0,Ugy31hPI2fXRLnZT3bh4AaABAg,Kub1jzGrM8s,they dont keep you from getting the virus . people dont understand that it is a sugar pill .  oh well when they all die off because they are dumb sheep only the wolves will be left,2
youtube#commentThread,TRUE,TRUE,youtube#comment,UCZ3GRHJDJ6EOL8VefjDzeaQ,http://www.youtube.com/channel/UCZ3GRHJDJ6EOL8VefjDzeaQ,max power,https://yt3.ggpht.com/ytc/AKedOLQDunrv2nZFiYgmpWgqW1iKvq2A1Cm2jmVKvtCzUw=s48-c-k-c0x00ffffff-no-rj,TRUE,2,2021-12-19T03:49:53Z,Sheep get vaccinated,2021-12-19T03:49:53Z,none,0,UgzQOFp6Ju-Ud8yAc-p4AaABAg,Kub1jzGrM8s,Sheep get vaccinated,2
youtube#commentThread,TRUE,TRUE,youtube#comment,UCllo8Q0qU4ze2EKkkAAzsvA,http://www.youtube.com/channel/UCllo8Q0qU4ze2EKkkAAzsvA,Jx,https://yt3.ggpht.com/WECqZy34S24vtxY7pUCis2BGou7bOB7fp3LI2b8zmDVSl36TEwNAgEGSymgAgSDOwkaLUc4MtT4=s48-c-k-c0x00ffffff-no-rj,TRUE,1,2021-12-17T02:01:17Z,I will never get the vaccine,2021-12-17T02:01:17Z,none,0,UgwVOokE4BBonbXzzbN4AaABAg,Kub1jzGrM8s,I will never get the vaccine,2
youtube#commentThread,TRUE,TRUE,youtube#comment,UCY_tFJXV_Ia7AcWuzRFIUvg,http://www.youtube.com/channel/UCY_tFJXV_Ia7AcWuzRFIUvg,Lh,https://yt3.ggpht.com/ytc/AKedOLQRXKWJJhvPSMixnTDRrPcmgf1m7qQkpjqLbQ=s48-c-k-c0x00ffffff-no-rj,TRUE,2,2021-12-17T01:43:29Z,Because it's unsafe ...period,2021-12-17T01:43:29Z,none,0,UgyetAXyZl8QhVlh87B4AaABAg,Kub1jzGrM8s,Because it&#39;s unsafe ...period,2
youtube#commentThread,TRUE,TRUE,youtube#comment,UCs0DzjBBkSM4fkS2S0ZV_Dw,http://www.youtube.com/channel/UCs0DzjBBkSM4fkS2S0ZV_Dw,Joseph Bustamante,https://yt3.ggpht.com/ytc/AKedOLRxZuwcZ1aNdbWOzag4kaYG5bgucXADZaMwmw=s48-c-k-c0x00ffffff-no-rj,TRUE,2,2021-12-16T18:18:21Z,As a truck driver I will not get the vaccine,2021-12-16T18:18:21Z,none,0,UgwspCpIsw_CwXgCGsN4AaABAg,Kub1jzGrM8s,As a truck driver I will not get the vaccine,2
youtube#commentThread,TRUE,TRUE,youtube#comment,UCLHf3X6iS3ehYr-prgt5iHA,http://www.youtube.com/channel/UCLHf3X6iS3ehYr-prgt5iHA,New phone Who dis,https://yt3.ggpht.com/ytc/AKedOLQmRVTqFsWEm-LtoKGpofoBrr6AA6rcUdXp98Ex89vuZLpX3pmbVgi9i3boIqYO=s48-c-k-c0x00ffffff-no-rj,TRUE,0,2021-12-14T02:25:32Z,I have pure blood and always will,2021-12-14T02:25:32Z,none,0,UgzndJBS7eVVMre7D6t4AaABAg,Kub1jzGrM8s,I have pure blood and always will,2
youtube#commentThread,TRUE,TRUE,youtube#comment,UCaFkfivTWR28pv2QUO-4Obg,http://www.youtube.com/channel/UCaFkfivTWR28pv2QUO-4Obg,Bill Loney,https://yt3.ggpht.com/ytc/AKedOLTQs1LhMEZcBMKNevqFJduGCFZgZeCjppZj9arA=s48-c-k-c0x00ffffff-no-rj,TRUE,1,2021-12-13T04:51:24Z,"I'm against mask wearing and Covid vaccinations, but if you want to do that stuff, go right ahead, I couldn't care less, just don't make others do it if they don't want to",2021-12-13T04:51:24Z,none,0,Ugx1i-2D4GOIjtz6gFp4AaABAg,Kub1jzGrM8s,"I&#39;m against mask wearing and Covid vaccinations, but if you want to do that stuff, go right ahead, I couldn&#39;t care less, just don&#39;t make others do it if they don&#39;t want to",0
youtube#commentThread,TRUE,TRUE,youtube#comment,UCBpuvemMdoTPNl92iiKmOFQ,http://www.youtube.com/channel/UCBpuvemMdoTPNl92iiKmOFQ,Elly,https://yt3.ggpht.com/Ztd_udKWADBdeV8HrvD8kLZyZMiJQ-A2ja5WH5ksLVJpt7B-gwJ-LKZDGt4O_zDrvDbdt-aixQ=s48-c-k-c0x00ffffff-no-rj,TRUE,0,2021-12-12T23:03:37Z,I choose not to get one. Cuz our country has already made deal with pharam to get booster for next 3-4 years for all country . If we get one we will be forced to get it every year . Definitely NO !!!,2021-12-12T23:03:37Z,none,0,Ugy0ImcPaZUU-VAWzLx4AaABAg,Kub1jzGrM8s,I choose not to get one. Cuz our country has already made deal with pharam to get booster for next 3-4 years for all country . If we get one we will be forced to get it every year . Definitely NO !!!,2
youtube#commentThread,TRUE,TRUE,youtube#comment,UCme6l6rlu-KaAEvaOy1pQ2A,http://www.youtube.com/channel/UCme6l6rlu-KaAEvaOy1pQ2A,RedEagle1,https://yt3.ggpht.com/een8-sTMl_oHGe3frOS924E7EK9_RKwYLzKLThobhn9L_P4XzIlDZhhjV8N9fC9GoUNU6prdmw=s48-c-k-c0x00ffffff-no-rj,TRUE,1,2021-12-09T21:32:24Z,Ur not altering my DNA without a fight to the Death.,2021-12-09T21:32:24Z,none,0,UgxX-cH3pEnFe_HwUtl4AaABAg,Kub1jzGrM8s,Ur not altering my DNA without a fight to the Death.,2
youtube#commentThread,TRUE,TRUE,youtube#comment,UCpgkKvTO6ofbqhS64G1GeyA,http://www.youtube.com/channel/UCpgkKvTO6ofbqhS64G1GeyA,Relic Radiation,https://yt3.ggpht.com/ytc/AKedOLRsShNhTiV_zApXre4rml0gxxt9bjbLOZIV-go=s48-c-k-c0x00ffffff-no-rj,TRUE,3,2021-12-09T19:32:10Z,I am not vaccinated.  Healthy as a horse.,2021-12-09T19:32:10Z,none,1,UgzN4D3OB2DbzYuFVsB4AaABAg,Kub1jzGrM8s,I am not vaccinated.  Healthy as a horse.,2
youtube#commentThread,TRUE,TRUE,youtube#comment,UCx7C47P44uc_hSg29ZxrT3A,http://www.youtube.com/channel/UCx7C47P44uc_hSg29ZxrT3A,JoJo But,https://yt3.ggpht.com/ytc/AKedOLQG0y_Q5PfSVySWNXA1sdLNq4knoKj2M9jBoA=s48-c-k-c0x00ffffff-no-rj,TRUE,1,2021-12-09T04:04:17Z,"Enjoy your side effects! It will come and there will be nothing you can do about it.
The 99% survivable virus will look like a fun time compared to what’s in store for many of the vaxxed.",2021-12-09T04:04:17Z,none,0,Ugy1prisKPsvVwEtn294AaABAg,Kub1jzGrM8s,Enjoy your side effects! It will come and there will be nothing you can do about it.<br>The 99% survivable virus will look like a fun time compared to what’s in store for many of the vaxxed.,2
youtube#commentThread,TRUE,TRUE,youtube#comment,UCoSu8BjfTsJI2bHBGih02GA,http://www.youtube.com/channel/UCoSu8BjfTsJI2bHBGih02GA,Des Mar,https://yt3.ggpht.com/ytc/AKedOLR6YzqJplQZzidVP20G0OjkQt7UpIY_bNfO=s48-c-k-c0x00ffffff-no-rj,TRUE,0,2021-12-08T00:13:35Z,keep your poison,2021-12-08T00:13:35Z,none,0,Ugxy9z2bnJAOBeaQtGt4AaABAg,Kub1jzGrM8s,keep your poison,2
youtube#commentThread,TRUE,TRUE,youtube#comment,UCNyn8WRj5U9mU2Z3h7I73kQ,http://www.youtube.com/channel/UCNyn8WRj5U9mU2Z3h7I73kQ,Rob Whitney,https://yt3.ggpht.com/ytc/AKedOLTGNSw1phVUdNh4yvgnbR4XEaRtK99GvYe3Tz8aLlPpP882gHaQHlRqyZFqZz3z=s48-c-k-c0x00ffffff-no-rj,TRUE,0,2021-12-07T00:22:19Z,"C19 vaccines go down to less 30% after 6 months, MONEY MONEY MONEY, POWER POWER POWER",2021-12-07T00:22:19Z,none,0,UgxzilKJGrbDBmXfKUl4AaABAg,Kub1jzGrM8s,"C19 vaccines go down to less 30% after 6 months, MONEY MONEY MONEY, POWER POWER POWER",2
youtube#commentThread,TRUE,TRUE,youtube#comment,UCGnnXtAVnliL94JJzGWOx1A,http://www.youtube.com/channel/UCGnnXtAVnliL94JJzGWOx1A,Shoham C,https://yt3.ggpht.com/ytc/AKedOLS7a4dGheYntvWSpjUxZWUthTaUhNZoNE7xLHzCvQ=s48-c-k-c0x00ffffff-no-rj,TRUE,0,2021-12-06T17:12:14Z,WE ARE NOT YOUR LAB RATS 👏🏼👏🏼,2021-12-06T17:12:14Z,none,1,UgyeZ-4Gc8bpSh6L8_Z4AaABAg,Kub1jzGrM8s,WE ARE NOT YOUR LAB RATS 👏🏼👏🏼,2
youtube#commentThread,TRUE,TRUE,youtube#comment,UC80sQhh7QvQS6xna0FvE_Kw,http://www.youtube.com/channel/UC80sQhh7QvQS6xna0FvE_Kw,Art Dude,https://yt3.ggpht.com/ytc/AKedOLScxO256erfTd8A58w2aazyi0QVrHlSMwKO0Q=s48-c-k-c0x00ffffff-no-rj,TRUE,0,2021-12-05T21:40:54Z,"Might as well said...
SMART people are refusing the vaccine.",2021-12-05T21:40:54Z,none,0,Ugw6TJHnyTFH2OAfMRl4AaABAg,Kub1jzGrM8s,Might as well said...<br>SMART people are refusing the vaccine.,2
youtube#commentThread,TRUE,TRUE,youtube#comment,UC687uG6vckJMbBZdSkhTeww,http://www.youtube.com/channel/UC687uG6vckJMbBZdSkhTeww,Frost Reaper,https://yt3.ggpht.com/ytc/AKedOLS9IHQIBWqmkSotyCpDUs0wdSKCWAmS90caSw=s48-c-k-c0x00ffffff-no-rj,TRUE,0,2021-12-03T01:03:12Z,You will still get covid even if you are vaccinated. It does not help much at all....,2021-12-03T01:03:12Z,none,0,UgwJj5l6EGs2AYS7V0h4AaABAg,Kub1jzGrM8s,You will still get covid even if you are vaccinated. It does not help much at all....,2
youtube#commentThread,TRUE,TRUE,youtube#comment,UCqnlBrKl-Vgv1DWNCr1nWgg,http://www.youtube.com/channel/UCqnlBrKl-Vgv1DWNCr1nWgg,Alex Wood,https://yt3.ggpht.com/FkaKHcJzIaiJPPsmHSYsAIOr-3VyZ8jL-GUnUqL6Bvajcu2_Qp_CqGWUE2khOcRTyk5ro_FG1Q=s48-c-k-c0x00ffffff-no-rj,TRUE,16,2021-11-29T03:43:31Z,"I'm worried about the drastic increase in heart attacks, especially in young, healthy people. They tried putting it down to ""reduced activity during lockdown"", doubt it, happened to plenty of football players. I'd rather risk covid than a heart attack.",2021-11-29T03:43:50Z,none,1,UgzsYNY6CATc8SEbDdt4AaABAg,Kub1jzGrM8s,"I&#39;m worried about the drastic increase in heart attacks, especially in young, healthy people. They tried putting it down to &quot;reduced activity during lockdown&quot;, doubt it, happened to plenty of football players. I&#39;d rather risk covid than a heart attack.",2
youtube#commentThread,TRUE,TRUE,youtube#comment,UCGpdbL5Sfy4Zr_9_e7iXmxg,http://www.youtube.com/channel/UCGpdbL5Sfy4Zr_9_e7iXmxg,em D,https://yt3.ggpht.com/ytc/AKedOLSpWZAMntbigBiQkzDKszkKlpa-m33rTy_FsmQV=s48-c-k-c0x00ffffff-no-rj,TRUE,0,2021-11-29T01:59:23Z,"I won't get the vaccine. The Nazis and the Thalidomide baby situation comes to mind, Jones town comes to mind! Drink the coolaid if you want to but I won't!",2021-11-29T01:59:23Z,none,0,UgwicPzvnBg6meqUOw54AaABAg,Kub1jzGrM8s,"I won&#39;t get the vaccine. The Nazis and the Thalidomide baby situation comes to mind, Jones town comes to mind! Drink the coolaid if you want to but I won&#39;t!",2
youtube#commentThread,TRUE,TRUE,youtube#comment,UC_OQ2E47zmKU4KKR4Qi_woA,http://www.youtube.com/channel/UC_OQ2E47zmKU4KKR4Qi_woA,Yani Figueroa,https://yt3.ggpht.com/ytc/AKedOLSQAAp7vb2U_mRqMWi6Eln2znfhVhO8xhWae_MijQ=s48-c-k-c0x00ffffff-no-rj,TRUE,1,2021-11-28T01:21:59Z,Lies. Unvaccinated and never had Covid.,2021-11-28T01:21:59Z,none,0,Ugyf43LA_p2lT-ekLZ14AaABAg,Kub1jzGrM8s,Lies. Unvaccinated and never had Covid.,2
youtube#commentThread,TRUE,TRUE,youtube#comment,UC0AnYeGvlru0IMyPkoLdo-A,http://www.youtube.com/channel/UC0AnYeGvlru0IMyPkoLdo-A,Lloyd Francis,https://yt3.ggpht.com/hEziH_UulGsMjuiuVMgInggqscT0uvfEe5E0DdN9stJGjA1ZwV63BCtHw_ECAZ8O3c_nMqcOcQ=s48-c-k-c0x00ffffff-no-rj,TRUE,2,2021-11-26T19:44:49Z,"Thank you Lord Jesus for a Robust Immune system and strong T cells. Thank you Lord for Vitamin D3, 10;000 IU Daily, GINGER, Zinc and Elderberry. To God be the Glory.",2021-11-26T19:45:52Z,none,0,UgwOl_6l7MKFxSJh7el4AaABAg,Kub1jzGrM8s,"Thank you Lord Jesus for a Robust Immune system and strong T cells. Thank you Lord for Vitamin D3, 10;000 IU Daily, GINGER, Zinc and Elderberry. To God be the Glory.",2
youtube#commentThread,TRUE,TRUE,youtube#comment,UCaE_ylefLI7aFQ1Xn_glDjw,http://www.youtube.com/channel/UCaE_ylefLI7aFQ1Xn_glDjw,WoozyMan,https://yt3.ggpht.com/ytc/AKedOLTDmbyvO0jlFxshAKQnfNNtOhiLlyGS20UQUA=s48-c-k-c0x00ffffff-no-rj,TRUE,1,2021-11-26T14:31:18Z,"Revelations 13:17 - ""and that no man might buy or sell, save he that had the mark, or the name of the beast, or the number of his name.""
You're being conditioned for this.",2021-11-26T14:31:18Z,none,0,Ugw3BbLnWcJY16vQPcV4AaABAg,Kub1jzGrM8s,"Revelations 13:17 - &quot;and that no man might buy or sell, save he that had the mark, or the name of the beast, or the number of his name.&quot;<br>You&#39;re being conditioned for this.",2
youtube#commentThread,TRUE,TRUE,youtube#comment,UC_7gznNTxozq1L9JDWMqeWw,http://www.youtube.com/channel/UC_7gznNTxozq1L9JDWMqeWw,TanMan,https://yt3.ggpht.com/ytc/AKedOLSHmZWVfy4D-69MfiUxPZtooC7QiLmM0Zz6LQ0H=s48-c-k-c0x00ffffff-no-rj,TRUE,1,2021-11-25T13:11:15Z,"People that havent taken the vaccine are also the people that arent constantly in a state of media induced fear, didnt take government stimulus and kept working to keep our society above water. Thanks to all the heroes out there!",2021-11-25T13:11:48Z,none,0,UgykJq9ma6NBpw5JLxd4AaABAg,Kub1jzGrM8s,"People that havent taken the vaccine are also the people that arent constantly in a state of media induced fear, didnt take government stimulus and kept working to keep our society above water. Thanks to all the heroes out there!",2
youtube#commentThread,TRUE,TRUE,youtube#comment,UCsmxKXiYTrlnS1SZAgA5fjw,http://www.youtube.com/channel/UCsmxKXiYTrlnS1SZAgA5fjw,Nikki Adams,https://yt3.ggpht.com/ytc/AKedOLTS1tMhKOcU0Y9yx2jnM2_kggU2ppnpV9ddlA=s48-c-k-c0x00ffffff-no-rj,TRUE,0,2021-11-22T16:10:44Z,"They forgot the 30% of healthcare workers, the first responders...and how many tens of thousands in all branches of the military. We won’t be bullied or forced into believing a rushed injection is somehow better then the immune system the Good Lord gave us.",2021-11-22T16:10:44Z,none,0,UgyZbqTsZ580kyh7F4J4AaABAg,Kub1jzGrM8s,"They forgot the 30% of healthcare workers, the first responders...and how many tens of thousands in all branches of the military. We won’t be bullied or forced into believing a rushed injection is somehow better then the immune system the Good Lord gave us.",2
youtube#commentThread,TRUE,TRUE,youtube#comment,UC7luurGpWg-Di8qK9iRBOmA,http://www.youtube.com/channel/UC7luurGpWg-Di8qK9iRBOmA,Ruby Tuesday,https://yt3.ggpht.com/ytc/AKedOLS7oQiWrz_VdoOHVlbtR-20BcMn7bf5-eLjOg=s48-c-k-c0x00ffffff-no-rj,TRUE,0,2021-11-19T13:29:53Z,"So now the FDA won't release vaccine information for 55 years.  How's that for transparency?  Sure, I trust them, and the giant pharmaceutical companies.  Uh, no.",2021-11-19T13:29:53Z,none,0,UgzwDeAyIs0kEK5mKgt4AaABAg,Kub1jzGrM8s,"So now the FDA won&#39;t release vaccine information for 55 years.  How&#39;s that for transparency?  Sure, I trust them, and the giant pharmaceutical companies.  Uh, no.",2
youtube#commentThread,TRUE,TRUE,youtube#comment,UClhAo4Wd07q5o_gu66vg-ew,http://www.youtube.com/channel/UClhAo4Wd07q5o_gu66vg-ew,Life Without Fear,https://yt3.ggpht.com/ytc/AKedOLSoZjbdYKgdnJDSMYG-AJq2Dx-hIaEaTDFG-w=s48-c-k-c0x00ffffff-no-rj,TRUE,1,2021-11-18T23:40:50Z,Our president is a joke along with the vaccine agenda. A joke that’s attempting to be taken seriously.,2021-11-18T23:40:50Z,none,0,UgxowmxnXN4IeJREMgx4AaABAg,Kub1jzGrM8s,Our president is a joke along with the vaccine agenda. A joke that’s attempting to be taken seriously.,2
youtube#commentThread,TRUE,TRUE,youtube#comment,UCPO2C-rMkCBC9WVhqJBk5Ag,http://www.youtube.com/channel/UCPO2C-rMkCBC9WVhqJBk5Ag,Ben,https://yt3.ggpht.com/ytc/AKedOLRX2PjtNAeYqOknRZOE2WIf3LpfBBrjpGSXeDwAbQ=s48-c-k-c0x00ffffff-no-rj,TRUE,2,2021-11-17T17:01:21Z,"My uncle took the vax and ended up in the hospital with blood clots, no thank you!",2021-11-17T17:01:21Z,none,0,Ugw5WVYG3SPeMB1VBCF4AaABAg,Kub1jzGrM8s,"My uncle took the vax and ended up in the hospital with blood clots, no thank you!",2
youtube#commentThread,TRUE,TRUE,youtube#comment,UCMmXm3Vap8cPXu6jf6IBOqQ,http://www.youtube.com/channel/UCMmXm3Vap8cPXu6jf6IBOqQ,Chi-Vibes,https://yt3.ggpht.com/GWLPEgyWIZeZaW5HUpdi2qE_PbvVwpTgEkZJMhbVF8xDTBI7v1Kwn9wq5xfLILzBCipAUfDtMg=s48-c-k-c0x00ffffff-no-rj,TRUE,1,2021-11-17T08:47:05Z,"Proud Purebloods here.
We reject your fear mongering propaganda.",2021-11-17T08:47:05Z,none,0,Ugwy6C6_NuSuBajopjd4AaABAg,Kub1jzGrM8s,Proud Purebloods here.<br>We reject your fear mongering propaganda.,2
youtube#commentThread,TRUE,TRUE,youtube#comment,UCmJaq66ICTi8A7juxPaZzBA,http://www.youtube.com/channel/UCmJaq66ICTi8A7juxPaZzBA,James Pastore,https://yt3.ggpht.com/ytc/AKedOLSTckGfVQDF0394ctQoxYS29fzu7e1OHTdwPw=s48-c-k-c0x00ffffff-no-rj,TRUE,2,2021-11-17T04:20:52Z,Fake news. Do not read. More people that have been vaccinated are in hospitals than ones that have not been vaccinated. Keep trying to spread the fake new you WOKE news people!,2021-11-17T04:20:52Z,none,0,UgwCQH737XokAeXBAQB4AaABAg,Kub1jzGrM8s,Fake news. Do not read. More people that have been vaccinated are in hospitals than ones that have not been vaccinated. Keep trying to spread the fake new you WOKE news people!,2
youtube#commentThread,TRUE,TRUE,youtube#comment,UCagA2qFAUylAWTBuXA_29Wg,http://www.youtube.com/channel/UCagA2qFAUylAWTBuXA_29Wg,My Name,https://yt3.ggpht.com/ytc/AKedOLTMhSsuXrarJdtqYv9TNUqHvxRRkl_8Fz0JYz_k=s48-c-k-c0x00ffffff-no-rj,TRUE,0,2021-11-17T02:08:57Z,"It’s not a vaccine it’s an immune booster - you can get COVID even though you have 2 shots so why would I get vaccinated ? I like the fact I can’t go into a restaurants , not getting a hair cut or being let into a concert or sporting event…. I will never get the shot and no amount of restrictions will
Change that .",2021-11-17T02:08:57Z,none,0,UgyqaqBqwPLlYhyMGiZ4AaABAg,Kub1jzGrM8s,"It’s not a vaccine it’s an immune booster - you can get COVID even though you have 2 shots so why would I get vaccinated ? I like the fact I can’t go into a restaurants , not getting a hair cut or being let into a concert or sporting event…. I will never get the shot and no amount of restrictions will<br>Change that .",2
youtube#commentThread,TRUE,TRUE,youtube#comment,UCUgJsEBbiMd5xc4GuP2KfIA,http://www.youtube.com/channel/UCUgJsEBbiMd5xc4GuP2KfIA,TheMazeSystem,https://yt3.ggpht.com/ytc/AKedOLS7Xill_4f7gtKgWOxs7S2Ipa1a2kU_jDpAn3YO=s48-c-k-c0x00ffffff-no-rj,TRUE,1,2021-11-16T18:35:58Z,Four people in my family had covid they was all unvaccinated they only got a headache a mild one Thats ALL,2021-11-16T18:35:58Z,none,0,Ugyx-NkYeDD06M9xIkd4AaABAg,Kub1jzGrM8s,Four people in my family had covid they was all unvaccinated they only got a headache a mild one Thats ALL,2
youtube#commentThread,TRUE,TRUE,youtube#comment,UCs9QgURclINVyVemNdShdAA,http://www.youtube.com/channel/UCs9QgURclINVyVemNdShdAA,Michael Nitsch,https://yt3.ggpht.com/ytc/AKedOLSh3wuhziiL_PLdANcCqdbK7gh7o77aj-kN6-E0gg=s48-c-k-c0x00ffffff-no-rj,TRUE,0,2021-11-15T06:18:53Z,WAKE UP AMERICA OR DIE VITAMIN  C AND ZINC WILL KEEP YOU HEALTHY AND VIRUS-FREE!,2021-11-15T06:18:53Z,none,0,Ugxa9rYS9IS35PS4gqx4AaABAg,Kub1jzGrM8s,WAKE UP AMERICA OR DIE VITAMIN  C AND ZINC WILL KEEP YOU HEALTHY AND VIRUS-FREE!,2
youtube#commentThread,TRUE,TRUE,youtube#comment,UCj0MVfwc12x2VOBEr5EYF8g,http://www.youtube.com/channel/UCj0MVfwc12x2VOBEr5EYF8g,Vaderfan 1924,https://yt3.ggpht.com/ytc/AKedOLTfMSVdZzSH5B5lGV0bQMTbtD8av-qJs8efGQ=s48-c-k-c0x00ffffff-no-rj,TRUE,0,2021-11-15T02:50:04Z,The FDA approves poison and bans natural sweeteners and other natural substances,2021-11-15T02:50:04Z,none,0,Ugx6ExUwEdU2RFCirU14AaABAg,Kub1jzGrM8s,The FDA approves poison and bans natural sweeteners and other natural substances,2
youtube#commentThread,TRUE,TRUE,youtube#comment,UCbRDOGiFsboS4sHUmNMWDBQ,http://www.youtube.com/channel/UCbRDOGiFsboS4sHUmNMWDBQ,Rosie Collins,https://yt3.ggpht.com/ytc/AKedOLSkLDllYLU8f8rFPN-tj4Dho-0Ws8mEUVCiqQ=s48-c-k-c0x00ffffff-no-rj,TRUE,2,2021-11-14T21:43:38Z,People that do their homework will NOT get jabbed !!!,2021-11-14T21:43:38Z,none,0,Ugz5IaHAgmUKTK0JLed4AaABAg,Kub1jzGrM8s,People that do their homework will NOT get jabbed !!!,2
youtube#commentThread,TRUE,TRUE,youtube#comment,UCkY7cpYvYXoM2cZH-qu9yVQ,http://www.youtube.com/channel/UCkY7cpYvYXoM2cZH-qu9yVQ,Adam Marshall,https://yt3.ggpht.com/ytc/AKedOLQa0k0SSutRjsJx-aCR9PTrsfmbGG1dwne8Z2mA=s48-c-k-c0x00ffffff-no-rj,TRUE,0,2021-11-13T14:14:52Z,"I'd rather die from Covid than from the vaccine. So far, I've (allegedly) been in close proxomity to Covid cases for a couple of months and I seem to be just fine - what a surprise!",2021-11-13T14:14:52Z,none,0,UgwbX9HbyTybdAebt2J4AaABAg,Kub1jzGrM8s,"I&#39;d rather die from Covid than from the vaccine. So far, I&#39;ve (allegedly) been in close proxomity to Covid cases for a couple of months and I seem to be just fine - what a surprise!",2
youtube#commentThread,TRUE,TRUE,youtube#comment,UCiqNlmFRM87i3E64BGMY31g,http://www.youtube.com/channel/UCiqNlmFRM87i3E64BGMY31g,winklton,https://yt3.ggpht.com/ytc/AKedOLTi89wVzDZ_NHNmRSUhaDPYNGBPiEEQAnGEOw=s48-c-k-c0x00ffffff-no-rj,TRUE,1,2021-11-13T12:35:41Z,"70% of people in hospital HAVE been vaccinated in the uk 
The vaccine is useless",2021-11-13T12:35:41Z,none,0,Ugy0yTcHxVDIGxXmebJ4AaABAg,Kub1jzGrM8s,70% of people in hospital HAVE been vaccinated in the uk <br>The vaccine is useless,2
youtube#commentThread,TRUE,TRUE,youtube#comment,UC9rtNWgsc1cnh3hju0Qr8oQ,http://www.youtube.com/channel/UC9rtNWgsc1cnh3hju0Qr8oQ,peabody,https://yt3.ggpht.com/ytc/AKedOLTk7FthFSKe7BwSkB_qGA0PPbIhim6pUw0T1g=s48-c-k-c0x00ffffff-no-rj,TRUE,0,2021-11-13T01:55:43Z,if people do the research on the ingrediants of the  jab    they would be teriffied!!  is poison plain and simple........yur vaccinated and can still catch it and spread it.......HUUUUM   sum sing wong!!!,2021-11-13T01:55:43Z,none,0,UgxCyV4MXp9UhRy4z3d4AaABAg,Kub1jzGrM8s,if people do the research on the ingrediants of the  jab    they would be teriffied!!  is poison plain and simple........yur vaccinated and can still catch it and spread it.......HUUUUM   sum sing wong!!!,2
youtube#commentThread,TRUE,TRUE,youtube#comment,UC0jd0uJ5v4XTQXa_Iinc15Q,http://www.youtube.com/channel/UC0jd0uJ5v4XTQXa_Iinc15Q,HOPE PERREAULT,https://yt3.ggpht.com/ytc/AKedOLQYjwQZO-Sn1IdHjCfhpxA9A97RqHpTgEKvGg=s48-c-k-c0x00ffffff-no-rj,TRUE,2,2021-11-13T00:18:18Z,"People are dying! The pandemic was planned and failed, so now the murder jab!",2021-11-13T00:18:18Z,none,0,Ugwwk0BJh1lxT88gXWp4AaABAg,Kub1jzGrM8s,"People are dying! The pandemic was planned and failed, so now the murder jab!",2
youtube#commentThread,TRUE,TRUE,youtube#comment,UChdzX5le2j6qDf1QKp67n9Q,http://www.youtube.com/channel/UChdzX5le2j6qDf1QKp67n9Q,Jeepmosora,https://yt3.ggpht.com/ytc/AKedOLQflakqQUm8NstwrogdwGKhymBH4hi7jJ87gMap=s48-c-k-c0x00ffffff-no-rj,TRUE,1,2021-11-11T22:42:28Z,"I’m not talking the jab for the same reason I don’t play Russian Roulette.
How bout dat, 
plus 99.90% survival rate👈🤣⁉️",2021-11-11T22:42:28Z,none,0,Ugy8hRRz087woesbP5F4AaABAg,Kub1jzGrM8s,"I’m not talking the jab for the same reason I don’t play Russian Roulette.<br>How bout dat, <br>plus 99.90% survival rate👈🤣⁉️",2
youtube#commentThread,TRUE,TRUE,youtube#comment,UCBZTnVTNLWbXIE-UGrc184Q,http://www.youtube.com/channel/UCBZTnVTNLWbXIE-UGrc184Q,CHLMMA SQUAD,https://yt3.ggpht.com/ytc/AKedOLR4sJ9DfXOGv5N1fjfa3nD-k9u44osNDLoua9nZ=s48-c-k-c0x00ffffff-no-rj,TRUE,1,2021-11-11T17:42:33Z,I heard that some people who get the vaccine get serious health conditions... its so sad,2021-11-11T17:42:33Z,none,0,UgzlKmFdz8lZRG6LIPB4AaABAg,Kub1jzGrM8s,I heard that some people who get the vaccine get serious health conditions... its so sad,2
youtube#commentThread,TRUE,TRUE,youtube#comment,UCfSH7iln8ElyVk63fPynnnw,http://www.youtube.com/channel/UCfSH7iln8ElyVk63fPynnnw,Dank,https://yt3.ggpht.com/ytc/AKedOLSVBljEG4Lk5BelxmRTMxWQh5BVRzMq-ws6-4zz=s48-c-k-c0x00ffffff-no-rj,TRUE,1,2021-11-07T23:01:15Z,"i dont want the vaccine, they can shove it.",2021-11-07T23:01:15Z,none,1,UgyTu3-vDBxC7zGcNtd4AaABAg,Kub1jzGrM8s,"i dont want the vaccine, they can shove it.",2
youtube#commentThread,TRUE,TRUE,youtube#comment,UCYNR6nCpRSpmFuQo4zyfzaw,http://www.youtube.com/channel/UCYNR6nCpRSpmFuQo4zyfzaw,Freddy Garcia,https://yt3.ggpht.com/ytc/AKedOLQoOxV4SOi-DL25oWAqK8eaWtrrkcisoRpuDc3L5w=s48-c-k-c0x00ffffff-no-rj,TRUE,1,2021-11-07T22:12:58Z,"That's a fuckin lie, I am never getting that bullshit",2021-11-07T22:12:58Z,none,0,UgyAX0QXoWjTOS-nztN4AaABAg,Kub1jzGrM8s,"That&#39;s a fuckin lie, I am never getting that bullshit",2
youtube#commentThread,TRUE,TRUE,youtube#comment,UCVtiEGlE-3PyXsKFjSXmnuA,http://www.youtube.com/channel/UCVtiEGlE-3PyXsKFjSXmnuA,Prettyful Brown,https://yt3.ggpht.com/kKRe0rw1YiIbhnuqbmW9TmHdZW2yLHS_Gkj-gXNJ0bBix4W53jxa9KFi-bxHIsirITstrCfU=s48-c-k-c0x00ffffff-no-rj,TRUE,0,2021-11-07T21:04:26Z,why the push for a damn near useless vaccine though?,2021-11-07T21:04:26Z,none,1,UgyGVqs1rHEk_WeI1zJ4AaABAg,Kub1jzGrM8s,why the push for a damn near useless vaccine though?,2
youtube#commentThread,TRUE,TRUE,youtube#comment,UCGIQGg2QALZcdqo04CNhs7w,http://www.youtube.com/channel/UCGIQGg2QALZcdqo04CNhs7w,Jo Joe,https://yt3.ggpht.com/ytc/AKedOLQEFa3okeruQsLMJrHDE02P4-OTTdFm3VzGCA=s48-c-k-c0x00ffffff-no-rj,TRUE,1,2021-11-06T23:03:01Z,"97% survival rate, so why get the vaccine?",2021-11-06T23:03:01Z,none,0,UgziR6LsT23lAL0a8k54AaABAg,Kub1jzGrM8s,"97% survival rate, so why get the vaccine?",2
